<?xml version="1.0" encoding="UTF-8"?>

<!--
    Document   : dtd-check.xml
    Created on : 6 December 2004, 14:56
    Author     : ltran
    Description:
        Purpose of the document follows.
-->

<!DOCTYPE casegenix SYSTEM 'Casegenix-0.1.dtd'>
<casegenix>

<CASEDIARY type="insert">
    <CASEDIARY_intCaseDiaryKey>1</CASEDIARY_intCaseDiaryKey>
	<CASEDIARY_intCoreCaseKey>2</CASEDIARY_intCoreCaseKey>
	<CASEDIARY_strDate>1</CASEDIARY_strDate>
	<CASEDIARY_strTime>1</CASEDIARY_strTime>
	<CASEDIARY_strAction>2</CASEDIARY_strAction>
	<CASEDIARY_strTimeTakenHour>2</CASEDIARY_strTimeTakenHour>
	<CASEDIARY_strTimeTakenMin/>
	<!--CASEDIARY_strStatus>3</CASEDIARY_strStatus-->
	<CASEDIARY_strPriority>3</CASEDIARY_strPriority>
	<CASEDIARY_strBranchPriority>3</CASEDIARY_strBranchPriority>
	<CASEDIARY_strOwner>3</CASEDIARY_strOwner>
	<CASEDIARY_intSaved>3</CASEDIARY_intSaved>
</CASEDIARY>    

</casegenix>    


